<?xml version='1.0' encoding='UTF-8'?>
<gpcML xmlns:xsi="http://www.w3.org/2001/XMLSchema-instance" Version="TODO" id="0" xsi:noNamespaceSchemaLocation="gpcML.xsd">
  <ContactList>
    <Contact FirstName="Oliver" MiddleName="H" LastName="Cruse" E-mail="ocru0003@student.monash.edu" Institution="Monash University"/>
  </ContactList>
  <Metadata date="2025-10-20" MethodName="C:\_Projects\lily17102025" CalibrationName="C:\_Projects\CAL_Lily_17102025.CAL" Operator="gpc118" InstrumentName="gpc118" RunTime="00:40:00" lastServiceDate="2025-12-01" SampleName="Vial  72: OC_240_PSTY_42h - 1"/>
  <RunTimeData>
    <InstrumentConfiguration>
      <ColumnList>
        <GuardColumn PoreSizeMin="0" PoreSizeMax="0" StationaryPhase="TODO" DateOfInstallation="2025-12-02"/>
        <Column PoreSizeMin="10000" PoreSizeMax="100000" StationaryPhase="styrene-divinylbenzene" DateOfInstallation="2025-12-02"/></ColumnList>
      <OvenList>
        <ColumnOven Temperature="40.000"/>
      </OvenList>
      <Pump FlowRate="1.000"/>
      <Injector InjectionVolume="100.000"/>
      <Eluent>
        <SolventName>THF</SolventName>
        <AdditiveName>LiBr</AdditiveName>
        <RecyclingMode>false</RecyclingMode>
        <AdditiveConcentration>0.8685</AdditiveConcentration>
      </Eluent>
    </InstrumentConfiguration>
    <RawData Compression="false">UmVsYXRpdmUgdGltZSAobWluKSxSSSBzaWduYWwNCjkuNzY5MTcwLC0xLjE2NDA2MA0KOS43ODU4MzAsLTEuMTYzOTgwDQo5LjgwMjUwMCwtMS4xNjM4NTANCjkuODE5MTcwLC0xLjE2MzcwMA0KOS44MzU4MzAsLTEuMTYzNTMwDQo5Ljg1MjUwMCwtMS4xNjMzNDANCjkuODY5MTcwLC0xLjE2MzE5MA0KOS44ODU4MzAsLTEuMTYzMTAwDQo5LjkwMjUwMCwtMS4xNjMwNTANCjkuOTE5MTcwLC0xLjE2MzAyMA0KOS45MzU4MzAsLTEuMTYzMDEwDQo5Ljk1MjUwMCwtMS4xNjI5OTANCjkuOTY5MTcwLC0xLjE2Mjk0MA0KOS45ODU4MzAsLTEuMTYyODYwDQoxMC4wMDI1MDAsLTEuMTYyNzYwDQoxMC4wMTkyMDAsLTEuMTYyNjMwDQoxMC4wMzU4MDAsLTEuMTYyNTAwDQoxMC4wNTI1MDAsLTEuMTYyMzcwDQoxMC4wNjkyMDAsLTEuMTYyMjMwDQoxMC4wODU4MDAsLTEuMTYyMTIwDQoxMC4xMDI1MDAsLTEuMTYyMDUwDQoxMC4xMTkyMDAsLTEuMTYyMDAwDQoxMC4xMzU4MDAsLTEuMTYxOTcwDQoxMC4xNTI1MDAsLTEuMTYxOTcwDQoxMC4xNjkyMDAsLTEuMTYxOTkwDQoxMC4xODU4MDAsLTEuMTYyMDQwDQoxMC4yMDI1MDAsLTEuMTYyMTEwDQoxMC4yMTkyMDAsLTEuMTYyMTgwDQoxMC4yMzU4MDAsLTEuMTYyMjQwDQoxMC4yNTI1MDAsLTEuMTYyMjcwDQoxMC4yNjkyMDAsLTEuMTYyMjcwDQoxMC4yODU4MDAsLTEuMTYyMjIwDQoxMC4zMDI1MDAsLTEuMTYyMTUwDQoxMC4zMTkyMDAsLTEuMTYyMDYwDQoxMC4zMzU4MDAsLTEuMTYxOTcwDQoxMC4zNTI1MDAsLTEuMTYxOTAwDQoxMC4zNjkyMDAsLTEuMTYxODQwDQoxMC4zODU4MDAsLTEuMTYxNzkwDQoxMC40MDI1MDAsLTEuMTYxNzMwDQoxMC40MTkyMDAsLTEuMTYxNjUwDQoxMC40MzU4MDAsLTEuMTYxNTQwDQoxMC40NTI1MDAsLTEuMTYxMzkwDQoxMC40NjkyMDAsLTEuMTYxMjMwDQoxMC40ODU4MDAsLTEuMTYxMDQwDQoxMC41MDI1MDAsLTEuMTYwNzgwDQoxMC41MTkyMDAsLTEuMTYwNTkwDQoxMC41MzU4MDAsLTEuMTYwNDQwDQoxMC41NTI1MDAsLTEuMTYwMzQwDQoxMC41NjkyMDAsLTEuMTYwMjYwDQoxMC41ODU4MDAsLTEuMTYwMjEwDQoxMC42MDI1MDAsLTEuMTYwMTcwDQoxMC42MTkyMDAsLTEuMTYwMTUwDQoxMC42MzU4MDAsLTEuMTYwMTYwDQoxMC42NTI1MDAsLTEuMTYwMTcwDQoxMC42NjkyMDAsLTEuMTYwMTgwDQoxMC42ODU4MDAsLTEuMTYwMjAwDQoxMC43MDI1MDAsLTEuMTYwMjIwDQoxMC43MTkyMDAsLTEuMTYwMjQwDQoxMC43MzU4MDAsLTEuMTYwMjgwDQoxMC43NTI1MDAsLTEuMTYwMzIwDQoxMC43NjkyMDAsLTEuMTYwMzgwDQoxMC43ODU4MDAsLTEuMTYwNDQwDQoxMC44MDI1MDAsLTEuMTYwNTIwDQoxMC44MTkyMDAsLTEuMTYwNjIwDQoxMC44MzU4MDAsLTEuMTYwNjkwDQoxMC44NTI1MDAsLTEuMTYwNzIwDQoxMC44NjkyMDAsLTEuMTYwNzEwDQoxMC44ODU4MDAsLTEuMTYwNjYwDQoxMC45MDI1MDAsLTEuMTYwNTQwDQoxMC45MTkyMDAsLTEuMTYwMzQwDQoxMC45MzU4MDAsLTEuMTYwMTAwDQoxMC45NTI1MDAsLTEuMTU5ODUwDQoxMC45NjkyMDAsLTEuMTU5NjEwDQoxMC45ODU4MDAsLTEuMTU5MzYwDQoxMS4wMDI1MDAsLTEuMTU5MTIwDQoxMS4wMTkyMDAsLTEuMTU4OTEwDQoxMS4wMzU4MDAsLTEuMTU4NzUwDQoxMS4wNTI1MDAsLTEuMTU4NjQwDQoxMS4wNjkyMDAsLTEuMTU4NTgwDQoxMS4wODU4MDAsLTEuMTU4NTYwDQoxMS4xMDI1MDAsLTEuMTU4NTgwDQoxMS4xMTkyMDAsLTEuMTU4NjYwDQoxMS4xMzU4MDAsLTEuMTU4ODAwDQoxMS4xNTI1MDAsLTEuMTU4OTQwDQoxMS4xNjkyMDAsLTEuMTU5MDcwDQoxMS4xODU4MDAsLTEuMTU5MTcwDQoxMS4yMDI1MDAsLTEuMTU5MjMwDQoxMS4yMTkyMDAsLTEuMTU5MjUwDQoxMS4yMzU4MDAsLTEuMTU5MjMwDQoxMS4yNTI1MDAsLTEuMTU5MTcwDQoxMS4yNjkyMDAsLTEuMTU5MDcwDQoxMS4yODU4MDAsLTEuMTU4OTYwDQoxMS4zMDI1MDAsLTEuMTU4ODIwDQoxMS4zMTkyMDAsLTEuMTU4NjYwDQoxMS4zMzU4MDAsLTEuMTU4NDQwDQoxMS4zNTI1MDAsLTEuMTU4MjcwDQoxMS4zNjkyMDAsLTEuMTU4MTQwDQoxMS4zODU4MDAsLTEuMTU4MDYwDQoxMS40MDI1MDAsLTEuMTU4MDQwDQoxMS40MTkyMDAsLTEuMTU4MDYwDQoxMS40MzU4MDAsLTEuMTU4MTMwDQoxMS40NTI1MDAsLTEuMTU4MjIwDQoxMS40NjkyMDAsLTEuMTU4MjcwDQoxMS40ODU4MDAsLTEuMTU4MjgwDQoxMS41MDI1MDAsLTEuMTU4MjQwDQoxMS41MTkyMDAsLTEuMTU4MTYwDQoxMS41MzU4MDAsLTEuMTU4MDUwDQoxMS41NTI1MDAsLTEuMTU3OTAwDQoxMS41NjkyMDAsLTEuMTU3NzgwDQoxMS41ODU4MDAsLTEuMTU3NzEwDQoxMS42MDI1MDAsLTEuMTU3NjgwDQoxMS42MTkyMDAsLTEuMTU3NjkwDQoxMS42MzU4MDAsLTEuMTU3NzEwDQoxMS42NTI1MDAsLTEuMTU3NzMwDQoxMS42NjkyMDAsLTEuMTU3NzQwDQoxMS42ODU4MDAsLTEuMTU3NzIwDQoxMS43MDI1MDAsLTEuMTU3NjcwDQoxMS43MTkyMDAsLTEuMTU3NTgwDQoxMS43MzU4MDAsLTEuMTU3NDcwDQoxMS43NTI1MDAsLTEuMTU3MzMwDQoxMS43NjkyMDAsLTEuMTU3MTIwDQoxMS43ODU4MDAsLTEuMTU2OTMwDQoxMS44MDI1MDAsLTEuMTU2NzQwDQoxMS44MTkyMDAsLTEuMTU2NTYwDQoxMS44MzU4MDAsLTEuMTU2MzkwDQoxMS44NTI1MDAsLTEuMTU2MjIwDQoxMS44NjkyMDAsLTEuMTU2MDQwDQoxMS44ODU4MDAsLTEuMTU1ODgwDQoxMS45MDI1MDAsLTEuMTU1NzUwDQoxMS45MTkyMDAsLTEuMTU1NjMwDQoxMS45MzU4MDAsLTEuMTU1NTIwDQoxMS45NTI1MDAsLTEuMTU1NDEwDQoxMS45NjkyMDAsLTEuMTU1MjkwDQoxMS45ODU4MDAsLTEuMTU1MTkwDQoxMi4wMDI1MDAsLTEuMTU1MTMwDQoxMi4wMTkyMDAsLTEuMTU1MDkwDQoxMi4wMzU4MDAsLTEuMTU1MDYwDQoxMi4wNTI1MDAsLTEuMTU1MDQwDQoxMi4wNjkyMDAsLTEuMTU1MDEwDQoxMi4wODU4MDAsLTEuMTU0OTcwDQoxMi4xMDI1MDAsLTEuMTU0OTMwDQoxMi4xMTkyMDAsLTEuMTU0OTAwDQoxMi4xMzU4MDAsLTEuMTU0ODkwDQoxMi4xNTI1MDAsLTEuMTU0OTAwDQoxMi4xNjkyMDAsLTEuMTU0OTYwDQoxMi4xODU4MDAsLTEuMTU1MDUwDQoxMi4yMDI1MDAsLTEuMTU1MTMwDQoxMi4yMTkyMDAsLTEuMTU1MTcwDQoxMi4yMzU4MDAsLTEuMTU1MTYwDQoxMi4yNTI1MDAsLTEuMTU1MDkwDQoxMi4yNjkyMDAsLTEuMTU0OTcwDQoxMi4yODU4MDAsLTEuMTU0NzkwDQoxMi4zMDI1MDAsLTEuMTU0NTMwDQoxMi4zMTkyMDAsLTEuMTU0MzMwDQoxMi4zMzU4MDAsLTEuMTU0MTkwDQoxMi4zNTI1MDAsLTEuMTU0MTEwDQoxMi4zNjkyMDAsLTEuMTU0MDkwDQoxMi4zODU4MDAsLTEuMTU0MTIwDQoxMi40MDI1MDAsLTEuMTU0MTcwDQoxMi40MTkyMDAsLTEuMTU0MTkwDQoxMi40MzU4MDAsLTEuMTU0MTYwDQoxMi40NTI1MDAsLTEuMTU0MDgwDQoxMi40NjkyMDAsLTEuMTUzOTcwDQoxMi40ODU4MDAsLTEuMTUzODIwDQoxMi41MDI1MDAsLTEuMTUzNjQwDQoxMi41MTkyMDAsLTEuMTUzNTIwDQoxMi41MzU4MDAsLTEuMTUzNDQwDQoxMi41NTI1MDAsLTEuMTUzMzgwDQoxMi41NjkyMDAsLTEuMTUzMzMwDQoxMi41ODU4MDAsLTEuMTUzMjUwDQoxMi42MDI1MDAsLTEuMTUzMTEwDQoxMi42MTkyMDAsLTEuMTUyODcwDQoxMi42MzU4MDAsLTEuMTUyNjAwDQoxMi42NTI1MDAsLTEuMTUyMzEwDQoxMi42NjkyMDAsLTEuMTUyMDIwDQoxMi42ODU4MDAsLTEuMTUxNzcwDQoxMi43MDI1MDAsLTEuMTUxNTUwDQoxMi43MTkyMDAsLTEuMTUxMzcwDQoxMi43MzU4MDAsLTEuMTUxMjgwDQoxMi43NTI1MDAsLTEuMTUxMjYwDQoxMi43NjkyMDAsLTEuMTUxMjcwDQoxMi43ODU4MDAsLTEuMTUxMzAwDQoxMi44MDI1MDAsLTEuMTUxMzMwDQoxMi44MTkyMDAsLTEuMTUxMzYwDQoxMi44MzU4MDAsLTEuMTUxMzgwDQoxMi44NTI1MDAsLTEuMTUxMzcwDQoxMi44NjkyMDAsLTEuMTUxMzQwDQoxMi44ODU4MDAsLTEuMTUxMjkwDQoxMi45MDI1MDAsLTEuMTUxMjQwDQoxMi45MTkyMDAsLTEuMTUxMTgwDQoxMi45MzU4MDAsLTEuMTUxMTMwDQoxMi45NTI1MDAsLTEuMTUxMTIwDQoxMi45NjkyMDAsLTEuMTUxMTUwDQoxMi45ODU4MDAsLTEuMTUxMjIwDQoxMy4wMDI1MDAsLTEuMTUxMzEwDQoxMy4wMTkyMDAsLTEuMTUxNDIwDQoxMy4wMzU4MDAsLTEuMTUxNTYwDQoxMy4wNTI1MDAsLTEuMTUxNjUwDQoxMy4wNjkyMDAsLTEuMTUxNzEwDQoxMy4wODU4MDAsLTEuMTUxNzIwDQoxMy4xMDI1MDAsLTEuMTUxNzAwDQoxMy4xMTkyMDAsLTEuMTUxNjUwDQoxMy4xMzU4MDAsLTEuMTUxNTcwDQoxMy4xNTI1MDAsLTEuMTUxNTAwDQoxMy4xNjkyMDAsLTEuMTUxNDQwDQoxMy4xODU4MDAsLTEuMTUxMzkwDQoxMy4yMDI1MDAsLTEuMTUxMzYwDQoxMy4yMTkyMDAsLTEuMTUxMzQwDQoxMy4yMzU4MDAsLTEuMTUxMzEwDQoxMy4yNTI1MDAsLTEuMTUxMjcwDQoxMy4yNjkyMDAsLTEuMTUxMjAwDQoxMy4yODU4MDAsLTEuMTUxMTAwDQoxMy4zMDI1MDAsLTEuMTUwOTgwDQoxMy4zMTkyMDAsLTEuMTUwODQwDQoxMy4zMzU4MDAsLTEuMTUwNjgwDQoxMy4zNTI1MDAsLTEuMTUwNTAwDQoxMy4zNjkyMDAsLTEuMTUwMzUwDQoxMy4zODU4MDAsLTEuMTUwMjIwDQoxMy40MDI1MDAsLTEuMTUwMTEwDQoxMy40MTkyMDAsLTEuMTUwMDEwDQoxMy40MzU4MDAsLTEuMTQ5ODgwDQoxMy40NTI1MDAsLTEuMTQ5NzQwDQoxMy40NjkyMDAsLTEuMTQ5NjAwDQoxMy40ODU4MDAsLTEuMTQ5NDUwDQoxMy41MDI1MDAsLTEuMTQ5MzEwDQoxMy41MTkyMDAsLTEuMTQ5MTgwDQoxMy41MzU4MDAsLTEuMTQ5MDcwDQoxMy41NTI1MDAsLTEuMTQ4OTkwDQoxMy41NjkyMDAsLTEuMTQ4OTUwDQoxMy41ODU4MDAsLTEuMTQ4OTkwDQoxMy42MDI1MDAsLTEuMTQ5MDgwDQoxMy42MTkyMDAsLTEuMTQ5MjQwDQoxMy42MzU4MDAsLTEuMTQ5NDMwDQoxMy42NTI1MDAsLTEuMTQ5NjcwDQoxMy42NjkyMDAsLTEuMTQ5OTkwDQoxMy42ODU4MDAsLTEuMTUwMjgwDQoxMy43MDI1MDAsLTEuMTUwNTMwDQoxMy43MTkyMDAsLTEuMTUwNzYwDQoxMy43MzU4MDAsLTEuMTUwOTcwDQoxMy43NTI1MDAsLTEuMTUxMTQwDQoxMy43NjkyMDAsLTEuMTUxMzIwDQoxMy43ODU4MDAsLTEuMTUxNDQwDQoxMy44MDI1MDAsLTEuMTUxNTAwDQoxMy44MTkyMDAsLTEuMTUxNTEwDQoxMy44MzU4MDAsLTEuMTUxNDcwDQoxMy44NTI1MDAsLTEuMTUxNDAwDQoxMy44NjkyMDAsLTEuMTUxMjkwDQoxMy44ODU4MDAsLTEuMTUxMTYwDQoxMy45MDI1MDAsLTEuMTUxMDgwDQoxMy45MTkyMDAsLTEuMTUxMDMwDQoxMy45MzU4MDAsLTEuMTUxMDIwDQoxMy45NTI1MDAsLTEuMTUxMDQwDQoxMy45NjkyMDAsLTEuMTUxMTAwDQoxMy45ODU4MDAsLTEuMTUxMTcwDQoxNC4wMDI1MDAsLTEuMTUxMjIwDQoxNC4wMTkyMDAsLTEuMTUxMjUwDQoxNC4wMzU4MDAsLTEuMTUxMjQwDQoxNC4wNTI1MDAsLTEuMTUxMjEwDQoxNC4wNjkyMDAsLTEuMTUxMTQwDQoxNC4wODU4MDAsLTEuMTUxMDMwDQoxNC4xMDI1MDAsLTEuMTUwODYwDQoxNC4xMTkyMDAsLTEuMTUwNzAwDQoxNC4xMzU4MDAsLTEuMTUwNTcwDQoxNC4xNTI1MDAsLTEuMTUwNDQwDQoxNC4xNjkyMDAsLTEuMTUwMzUwDQoxNC4xODU4MDAsLTEuMTUwMzAwDQoxNC4yMDI1MDAsLTEuMTUwMjkwDQoxNC4yMTkyMDAsLTEuMTUwMzEwDQoxNC4yMzU4MDAsLTEuMTUwMzQwDQoxNC4yNTI1MDAsLTEuMTUwMzcwDQoxNC4yNjkyMDAsLTEuMTUwMzgwDQoxNC4yODU4MDAsLTEuMTUwMzYwDQoxNC4zMDI1MDAsLTEuMTUwMjkwDQoxNC4zMTkyMDAsLTEuMTUwMTgwDQoxNC4zMzU4MDAsLTEuMTUwMDQwDQoxNC4zNTI1MDAsLTEuMTQ5ODgwDQoxNC4zNjkyMDAsLTEuMTQ5NzEwDQoxNC4zODU4MDAsLTEuMTQ5NTQwDQoxNC40MDI1MDAsLTEuMTQ5MzYwDQoxNC40MTkyMDAsLTEuMTQ5MTcwDQoxNC40MzU4MDAsLTEuMTQ5MDQwDQoxNC40NTI1MDAsLTEuMTQ4OTQwDQoxNC40NjkyMDAsLTEuMTQ4ODcwDQoxNC40ODU4MDAsLTEuMTQ4ODAwDQoxNC41MDI1MDAsLTEuMTQ4NzQwDQoxNC41MTkyMDAsLTEuMTQ4NjYwDQoxNC41MzU4MDAsLTEuMTQ4NTcwDQoxNC41NTI1MDAsLTEuMTQ4NDkwDQoxNC41NjkyMDAsLTEuMTQ4NDAwDQoxNC41ODU4MDAsLTEuMTQ4MzMwDQoxNC42MDI1MDAsLTEuMTQ4MjUwDQoxNC42MTkyMDAsLTEuMTQ4MTcwDQoxNC42MzU4MDAsLTEuMTQ4MTAwDQoxNC42NTI1MDAsLTEuMTQ4MDIwDQoxNC42NjkyMDAsLTEuMTQ3OTMwDQoxNC42ODU4MDAsLTEuMTQ3ODUwDQoxNC43MDI1MDAsLTEuMTQ3NzYwDQoxNC43MTkyMDAsLTEuMTQ3NjcwDQoxNC43MzU4MDAsLTEuMTQ3NjAwDQoxNC43NTI1MDAsLTEuMTQ3NTUwDQoxNC43NjkyMDAsLTEuMTQ3NTEwDQoxNC43ODU4MDAsLTEuMTQ3NDYwDQoxNC44MDI1MDAsLTEuMTQ3NDEwDQoxNC44MTkyMDAsLTEuMTQ3MzMwDQoxNC44MzU4MDAsLTEuMTQ3MjAwDQoxNC44NTI1MDAsLTEuMTQ3MDgwDQoxNC44NjkyMDAsLTEuMTQ2OTUwDQoxNC44ODU4MDAsLTEuMTQ2ODIwDQoxNC45MD